{
  "formatVersion": 1,
  "releaseId": "00000000-0000-4000-8000-000000000002",
  "version": "0.3.1",
  "createdAt": "2026-01-01T00:00:00Z",
  "minimumServerVersion": "0.1.0",
  "architectures": ["amd64", "arm64"],
  "signature": {
    "algorithm": "Ed25519",
    "keyId": "example-release-key"
  },
  "preservesInstanceData": true,
  "migrations": ["0023_add_video_assets", "0024_add_power_schedule"],
  "artifacts": [
    {
      "path": "android/roomframe-home.apk",
      "sha256": "0000000000000000000000000000000000000000000000000000000000000000",
      "size": 0,
      "kind": "home-apk",
      "packageName": "org.roomframe.tv",
      "versionCode": 4,
      "signingCertificateSha256": "0000000000000000000000000000000000000000000000000000000000000000"
    }
  ]
}
